<?xml version="1.0" encoding="UTF-8"?>

<!--
    Document   : insa.xml
    Created on : 9 dÃ©cembre 2013, 12:46
    Author     : admin
    Description:
        Purpose of the document follows.
-->

<scenario xmlns:xsi="http://www.w3.org/2001/XMLSchema-instance" xsi:noNamespaceSchemaLocation="scenario.xsd">
    <configuration>
        <actor identifier="1">
            <type>consumer</type>
            <address>http://localhost:8080/ConsumerProject/ConsumerWebServiceService?wsdl</address>
        </actor>
        <actor identifier="2">
            <type>consumer</type>
            <address>192.168.1.3</address>
        </actor>
        <actor identifier="3">
            <type>consumer</type>
            <address>192.168.1.4</address>
        </actor>
        <actor identifier="51">
            <type>provider</type>
            <address>192.168.1.5</address>
        </actor>
        <actor identifier="52">
            <type>provider</type>
            <address>192.168.1.6</address>
        </actor>
    </configuration>
    <consumers>
        <consumer identifier="1">
                <phaseConsumer>
                    <providerId>51</providerId>
                    <trafficClass>BE</trafficClass>
                    <numberOfRequests>3000</numberOfRequests>
                    <sendPeriod>1</sendPeriod>
                    <packetSize>1024</packetSize>
                    <startDate>0</startDate>
                    <numberOfBursts>1000</numberOfBursts>
                </phaseConsumer>
                <phaseConsumer>
                    <providerId>51</providerId>
                    <trafficClass>RT</trafficClass>
                    <numberOfRequests>5000</numberOfRequests>
                    <sendPeriod>1</sendPeriod>
                    <packetSize>1024</packetSize>
                    <startDate>1000</startDate>
                    <numberOfBursts>2000</numberOfBursts>
                </phaseConsumer>
        </consumer>
        <!--
        <consumer identifier="2">

                <phaseConsumer>
                    <providerId>52</providerId>
                    <trafficClass>RT</trafficClass>
                    <numberOfRequests>9000</numberOfRequests>
                    <sendPeriod>2</sendPeriod>
                    <packetSize>1024</packetSize>
                    <startDate>0</startDate>
                    <numberOfBursts>3000</numberOfBursts>
                </phaseConsumer>

        </consumer>
        <consumer identifier="3">
                <phaseConsumer>
                    <providerId>52</providerId>
                    <trafficClass>RT</trafficClass>
                    <numberOfRequests>5000</numberOfRequests>
                    <sendPeriod>3</sendPeriod>
                    <packetSize>2048</packetSize>
                    <startDate>0</startDate>
                    <numberOfBursts>1000</numberOfBursts>
                </phaseConsumer>
                <phaseConsumer>
                    <providerId>52</providerId>
                    <trafficClass>RT</trafficClass>
                    <numberOfRequests>5000</numberOfRequests>
                    <sendPeriod>2</sendPeriod>
                    <packetSize>2048</packetSize>
                    <startDate>1000</startDate>
                    <numberOfBursts>500</numberOfBursts>
                </phaseConsumer>
                <phaseConsumer>
                    <providerId>51</providerId>
                    <trafficClass>RT</trafficClass>
                    <numberOfRequests>5000</numberOfRequests>
                    <sendPeriod>50</sendPeriod>
                    <packetSize>4096</packetSize>
                    <startDate>2000</startDate>
                    <numberOfBursts>20</numberOfBursts>
                </phaseConsumer>
        </consumer>
-->
    </consumers>
    <providers>
        <provider identifier="51">
            <phaseProvider>
                <processingTime>0.001</processingTime>
                <numberOfResponses>112</numberOfResponses>
                <packetSize>1024</packetSize>
                <percentageLoss>0.01</percentageLoss>
                <startDate>0</startDate>
                <endDate>500</endDate>
            </phaseProvider>
            <phaseProvider>
                <processingTime>0.00003</processingTime>
                <numberOfResponses>76</numberOfResponses>
                <packetSize>2048</packetSize>
                <percentageLoss>0.05</percentageLoss>
                <startDate>500</startDate>
                <endDate>2500</endDate>
            </phaseProvider>
            <phaseProvider>
                <processingTime>0.01</processingTime>
                <numberOfResponses>50</numberOfResponses>
                <packetSize>1024</packetSize>
                <percentageLoss>0.02</percentageLoss>
                <startDate>2500</startDate>
                <endDate>3000</endDate>
            </phaseProvider>
        </provider>
        <provider identifier="52">
            <phaseProvider>
                <processingTime>0.01</processingTime>
                <numberOfResponses>22</numberOfResponses>
                <packetSize>1024</packetSize>
                <percentageLoss>0.02</percentageLoss>
                <startDate>0</startDate>
                <endDate>3000</endDate>
            </phaseProvider>
        </provider>
    </providers>
</scenario>


